{
  "messageId": "message-id-example",
  "type": "StartSessionMediaCapture",
  "version": "1.0.0",
  "occurredAt": "2026-09-08T12:00:00Z",
  "tenantId": "tenant-id-example",
  "regionId": "region-id-example",
  "clusterId": "cluster-id-example",
  "correlationId": "correlation-id-example",
  "data": {
    "sessionId": "session-id-example",
    "ownerEpoch": "1",
    "recordingId": "recording-id-example",
    "audio": true,
    "video": false,
    "policy": {
      "eventsRequired": true,
      "audioEnabled": false,
      "videoEnabled": false,
      "eventRetentionDays": 1,
      "mediaRetentionDays": 1,
      "segmentDurationMs": 250,
      "mediaFailureMode": "continue-with-gap",
      "policyRevision": "1"
    }
  },
  "idempotencyKey": "idempotency-key-example",
  "aggregateId": "aggregate-id-example",
  "aggregateRevision": "1",
  "causationId": "causation-id-example"
}
